{
  "candidateId": "cand_daily_20260820_01",
  "contractVersion": "1.0.0",
  "deliveryRequired": true,
  "errorCode": null,
  "issueDate": "2026-08-20",
  "llmOutcome": {
    "attempts": [
      {
        "accepted": false,
        "errorCode": "PROVIDER_UNAVAILABLE",
        "model": "gpt-5.5",
        "order": 1,
        "provider": "openai",
        "status": "error"
      }
    ],
    "deterministicFallback": {
      "implementation": "rules-daily",
      "version": "1"
    },
    "effective": null,
    "effectiveAttemptOrder": null,
    "requested": {
      "model": "gpt-5.5",
      "provider": "openai"
    },
    "status": "unavailable"
  },
  "nextAction": null,
  "operation": "daily",
  "publicationStatus": "published",
  "publicationSucceeded": true,
  "publisherResultSha256": "5555555555555555555555555555555555555555555555555555555555555555",
  "releaseId": "rel_content_20260820_01",
  "summary": "Radar V2 issue 2026-08-20 published with deterministic fallback because all LLM attempts failed.",
  "warnings": [
    "All LLM providers unavailable; deterministic fallback published."
  ]
}
